{
  "$schema": "./api-manifest.schema.json",
  "schemaVersion": 1,
  "framework": "gluon",
  "packageContract": "package-contract.json",
  "concepts": [
    "components",
    "lifecycle",
    "reactivity",
    "store",
    "router",
    "ssr",
    "hydration",
    "i18n",
    "forms",
    "accessibility",
    "styles",
    "tooling"
  ],
  "diagnostics": {
    "catalog": "@gluonjs/compiler/diagnostics",
    "stableCodes": true
  },
  "validation": {
    "projectAnalysis": "gluon-project-analyze",
    "templateCheck": "gluon-check",
    "json": true
  },
  "packages": [
    {
      "name": "@gluonjs/reactivity",
      "environment": "universal",
      "exports": [
        ".",
        "./signals",
        "./preact-signals"
      ]
    },
    {
      "name": "@gluonjs/compiler",
      "environment": "universal",
      "exports": [
        ".",
        "./diagnostics"
      ]
    },
    {
      "name": "@gluonjs/core",
      "environment": "browser",
      "exports": [
        ".",
        "./decorators",
        "./styles",
        "./analytics",
        "./compat/lit"
      ]
    },
    {
      "name": "@gluonjs/router",
      "environment": "browser",
      "exports": [
        ".",
        "./memory"
      ]
    },
    {
      "name": "@gluonjs/store",
      "environment": "universal",
      "exports": [
        "."
      ]
    },
    {
      "name": "@gluonjs/i18n",
      "environment": "browser",
      "exports": [
        "."
      ]
    },
    {
      "name": "@gluonjs/ssr",
      "environment": "node",
      "exports": [
        ".",
        "./eleventy",
        "./hydration",
        "./static",
        "./streaming",
        "./tenant"
      ]
    },
    {
      "name": "@gluonjs/graphql",
      "environment": "universal",
      "exports": [
        "."
      ]
    },
    {
      "name": "@gluonjs/vite",
      "environment": "node",
      "exports": [
        ".",
        "./tailwind",
        "./tailwind.css"
      ]
    },
    {
      "name": "@gluonjs/gluon-components-vite",
      "environment": "browser",
      "exports": [
        ".",
        "./entry-preview",
        "./preset",
        "./renderer-preset"
      ]
    },
    {
      "name": "@gluonjs/test-utils",
      "environment": "browser",
      "exports": [
        ".",
        "./ssr"
      ]
    },
    {
      "name": "@gluonjs/devtools-api",
      "environment": "universal",
      "exports": [
        "."
      ]
    },
    {
      "name": "@gluonjs/devtools",
      "environment": "browser",
      "exports": [
        "."
      ]
    },
    {
      "name": "@gluonjs/graph",
      "environment": "browser",
      "exports": [
        "."
      ]
    },
    {
      "name": "@gluonjs/language-server",
      "environment": "node",
      "exports": [
        "."
      ]
    },
    {
      "name": "@gluonjs/vue-migration-analyzer",
      "environment": "node",
      "exports": [
        ".",
        "./schema"
      ]
    },
    {
      "name": "@gluonjs/quarks",
      "environment": "browser",
      "exports": [
        "."
      ]
    },
    {
      "name": "@gluonjs/atoms",
      "environment": "browser",
      "exports": [
        "."
      ]
    },
    {
      "name": "@gluonjs/molecules",
      "environment": "browser",
      "exports": [
        "."
      ]
    },
    {
      "name": "@gluonjs/organisms",
      "environment": "browser",
      "exports": [
        "."
      ]
    },
    {
      "name": "@gluonjs/json-forms",
      "environment": "browser",
      "exports": [
        "."
      ]
    },
    {
      "name": "create-gluon",
      "environment": "node",
      "exports": [
        "."
      ]
    }
  ]
}
